{
  "schema_version": "1.0",
  "program_id": "AE-SQ1",
  "corpus_id": "AE-SQ1-AQ-FRESH-V1",
  "split_id": "A",
  "split_nonce": "2807fa33c735a83c3aba5aef3d3df5c4fa1a1029bc12ee9eca4a62fd8b96b6d9",
  "authority": {
    "program_id": "AE-SQ1",
    "candidate_id": "SLEC-1",
    "candidate_commit": "0635f3d633f02bb99afd2e1218ec1135735a7496",
    "candidate_tree": "5b756da72fd112ce365c5e0e3957385ee5e6aa2a",
    "candidate_manifest_sha256": "c9c7292e963c8799f08ca5876a63ceea0e8d172fbd404ee1407570dcc4a1a5fe",
    "corpus_contract_sha256": "d480cbe2cc25d96f329011c5b788edcda701b9df56c527644237fff32d45a9dd",
    "gates_sha256": "c5278f7b7da46ff9da0df5369ba313b36be96240a4825a7a5916aed8441838bc",
    "metrics_sha256": "5171180e8b093b07d5341a626cea7270e878b201ad02c2c1b256e82dc2df86a4",
    "evaluator_schema_sha256": "056f2c0576d6e0b7ba741519ede3caf8262993472449742c7a66703436af958d",
    "outcome_blind_at_authoring": true,
    "prior_corpus_text_access": false
  },
  "no_replay": {
    "normalization_id": "ae-sq1-task-v1",
    "historical_digest_inventory_sha256": "d2151090e75464aa16e416fcd1df29676fd43d75bab47fc57271d5338ee26bf0",
    "historical_text_embedded": false
  },
  "cases": [
    {
      "case_id": "AE-SQ1-A-01",
      "case_nonce": "75d0165a23f868552af683b2d7227c3216c1e7b1d4a03581193b00e558694692",
      "task_text": "aster kiln brief 01 requests a bounded routing decision about copper lanterns, with a fresh constraint ledger and a named approval owner.",
      "task_text_nfc_sha256": "85413d3fe3629e114161e597a1375f860cff78bc7a591d46f27bb5ddf28ba32e",
      "profile": "none",
      "explicit_slot_id": null,
      "expected_capsules": [
        {
          "slot_id": "s0",
          "local_need": "no",
          "reference_need": "none"
        },
        {
          "slot_id": "s1",
          "local_need": "no",
          "reference_need": "none"
        },
        {
          "slot_id": "s2",
          "local_need": "no",
          "reference_need": "none"
        },
        {
          "slot_id": "s3",
          "local_need": "no",
          "reference_need": "none"
        }
      ],
      "expected_resolution": {
        "status": "none",
        "selected_slots": [],
        "reference_bundle": []
      }
    },
    {
      "case_id": "AE-SQ1-A-02",
      "case_nonce": "93a4cd2e81328d7e600ad2e60c46dcc14ec88a6596aff6abe12331e114cccd57",
      "task_text": "cobalt ferry brief 02 requests a bounded routing decision about copper lanterns, with a fresh constraint ledger and a named approval owner.",
      "task_text_nfc_sha256": "e7222ac3dd42caca0e4455bd64bf9c90459e252c88dcdc8d8c9d46f91541d73c",
      "profile": "none",
      "explicit_slot_id": null,
      "expected_capsules": [
        {
          "slot_id": "s0",
          "local_need": "no",
          "reference_need": "none"
        },
        {
          "slot_id": "s1",
          "local_need": "no",
          "reference_need": "none"
        },
        {
          "slot_id": "s2",
          "local_need": "no",
          "reference_need": "none"
        },
        {
          "slot_id": "s3",
          "local_need": "no",
          "reference_need": "none"
        }
      ],
      "expected_resolution": {
        "status": "none",
        "selected_slots": [],
        "reference_bundle": []
      }
    },
    {
      "case_id": "AE-SQ1-A-03",
      "case_nonce": "ae420c4e181c50b86a0d415d4b9694f145bb022cb6ddd5c81ec5a0d44a1213c5",
      "task_text": "dune observatory brief 03 requests a bounded routing decision about copper lanterns, with a fresh constraint ledger and a named approval owner.",
      "task_text_nfc_sha256": "07abedbbd9fc068ba782a2d1ff825b7d6dad2926f14b72ab929680c34a24f32f",
      "profile": "none",
      "explicit_slot_id": null,
      "expected_capsules": [
        {
          "slot_id": "s0",
          "local_need": "no",
          "reference_need": "none"
        },
        {
          "slot_id": "s1",
          "local_need": "no",
          "reference_need": "none"
        },
        {
          "slot_id": "s2",
          "local_need": "no",
          "reference_need": "none"
        },
        {
          "slot_id": "s3",
          "local_need": "no",
          "reference_need": "none"
        }
      ],
      "expected_resolution": {
        "status": "none",
        "selected_slots": [],
        "reference_bundle": []
      }
    },
    {
      "case_id": "AE-SQ1-A-04",
      "case_nonce": "2aa45295e45d73e9c93310530dc70c85becb5f3a46bac026b24c062dc4098c23",
      "task_text": "ember archive brief 04 requests a bounded routing decision about copper lanterns, with a fresh constraint ledger and a named approval owner.",
      "task_text_nfc_sha256": "4c380121b8b203121a18a0a1b871148bdc2d31ecb0899f34e042a95dd809cc4f",
      "profile": "none",
      "explicit_slot_id": null,
      "expected_capsules": [
        {
          "slot_id": "s0",
          "local_need": "no",
          "reference_need": "none"
        },
        {
          "slot_id": "s1",
          "local_need": "no",
          "reference_need": "none"
        },
        {
          "slot_id": "s2",
          "local_need": "no",
          "reference_need": "none"
        },
        {
          "slot_id": "s3",
          "local_need": "no",
          "reference_need": "none"
        }
      ],
      "expected_resolution": {
        "status": "none",
        "selected_slots": [],
        "reference_bundle": []
      }
    },
    {
      "case_id": "AE-SQ1-A-05",
      "case_nonce": "6a684d607cafcf6acb5aea6d538186abf551a7748edb10723c435037e601fcef",
      "task_text": "fjord workshop brief 05 requests a bounded routing decision about copper lanterns, with a fresh constraint ledger and a named approval owner.",
      "task_text_nfc_sha256": "b9d92035c5030c342a442d9f847bcbc8aab13a44cc9a2071ca4e3954b679f837",
      "profile": "none",
      "explicit_slot_id": null,
      "expected_capsules": [
        {
          "slot_id": "s0",
          "local_need": "no",
          "reference_need": "none"
        },
        {
          "slot_id": "s1",
          "local_need": "no",
          "reference_need": "none"
        },
        {
          "slot_id": "s2",
          "local_need": "no",
          "reference_need": "none"
        },
        {
          "slot_id": "s3",
          "local_need": "no",
          "reference_need": "none"
        }
      ],
      "expected_resolution": {
        "status": "none",
        "selected_slots": [],
        "reference_bundle": []
      }
    },
    {
      "case_id": "AE-SQ1-A-06",
      "case_nonce": "d1c4f2625abb52dcc8b3de48d119a03e584cd8efa1ad564c3c03f65cb15d81fc",
      "task_text": "granite meadow brief 06 requests a bounded routing decision about copper lanterns, with a fresh constraint ledger and a named approval owner.",
      "task_text_nfc_sha256": "5889f0c55b6b52b14467bf894c00aaed4d6d959d14300ef8444ceea4935dce29",
      "profile": "none",
      "explicit_slot_id": null,
      "expected_capsules": [
        {
          "slot_id": "s0",
          "local_need": "no",
          "reference_need": "none"
        },
        {
          "slot_id": "s1",
          "local_need": "no",
          "reference_need": "none"
        },
        {
          "slot_id": "s2",
          "local_need": "no",
          "reference_need": "none"
        },
        {
          "slot_id": "s3",
          "local_need": "no",
          "reference_need": "none"
        }
      ],
      "expected_resolution": {
        "status": "none",
        "selected_slots": [],
        "reference_bundle": []
      }
    },
    {
      "case_id": "AE-SQ1-A-07",
      "case_nonce": "88416e7d305ebfdf9123a6626539a91f4f416f2b7939d7adcd9a8f51bb530ec6",
      "task_text": "harbor turbine brief 07 requests a bounded routing decision about copper lanterns, with a fresh constraint ledger and a named approval owner.",
      "task_text_nfc_sha256": "9c97367f0419d1fe920d7da5eea6b56844ae08c5193a5ff735e5806981ee25bb",
      "profile": "single",
      "explicit_slot_id": null,
      "expected_capsules": [
        {
          "slot_id": "s0",
          "local_need": "yes",
          "reference_need": "focused"
        },
        {
          "slot_id": "s1",
          "local_need": "no",
          "reference_need": "none"
        },
        {
          "slot_id": "s2",
          "local_need": "no",
          "reference_need": "none"
        },
        {
          "slot_id": "s3",
          "local_need": "no",
          "reference_need": "none"
        }
      ],
      "expected_resolution": {
        "status": "selected",
        "selected_slots": [
          "s0"
        ],
        "reference_bundle": [
          {
            "slot_id": "s0",
            "need": "focused"
          }
        ]
      }
    },
    {
      "case_id": "AE-SQ1-A-08",
      "case_nonce": "196c876d7ddd2a92accf395e4173e30c0d76c571688a16d4a99c7532f2ac5fd7",
      "task_text": "ivory atlas brief 08 requests a bounded routing decision about copper lanterns, with a fresh constraint ledger and a named approval owner.",
      "task_text_nfc_sha256": "1df421c7d2274e49758378e8ed15b9bde72435eaef532741f558597aef6b01e5",
      "profile": "single",
      "explicit_slot_id": null,
      "expected_capsules": [
        {
          "slot_id": "s0",
          "local_need": "yes",
          "reference_need": "focused"
        },
        {
          "slot_id": "s1",
          "local_need": "no",
          "reference_need": "none"
        },
        {
          "slot_id": "s2",
          "local_need": "no",
          "reference_need": "none"
        },
        {
          "slot_id": "s3",
          "local_need": "no",
          "reference_need": "none"
        }
      ],
      "expected_resolution": {
        "status": "selected",
        "selected_slots": [
          "s0"
        ],
        "reference_bundle": [
          {
            "slot_id": "s0",
            "need": "focused"
          }
        ]
      }
    },
    {